{
  "id": "sara-rag-v2",
  "persona": "سارا، توسعه‌دهنده‌ی بک‌اند",
  "goal_fa": "یادگیری ساخت یک قابلیت RAG قابل ارزیابی برای استفاده در محصول شرکت",
  "persian_access_required": true,
  "budget": {
    "control_min_toman": 0,
    "control_max_toman": 30000000,
    "control_step_toman": 500000,
    "preferred_max_toman": 5000000,
    "flexible_max_toman": 10000000
  },
  "time": {
    "preferred_deadline_weeks": 12,
    "flexible_deadline_weeks": 20,
    "preferred_hours_per_week": 6,
    "flexible_hours_per_week": 10
  },
  "skills": {
    "python": "intermediate",
    "software_engineering": "intermediate",
    "rag": "none",
    "langchain": "none"
  },
  "priorities": {
    "required_topics": {
      "rag_foundations": "must",
      "evaluation": "must"
    },
    "hands_on_project": "high",
    "mentor_support": "medium",
    "certificate": "low"
  }
}
